{
  "key": "efqm-2020-advanced",
  "name": "business matrix advanced",
  "orderIndex": 3,
  "logoAsset": "assess-3-img",
  "shortDescription": "Lorem ipsum dolor sit amet, consectetur adipiscing elit. Morbi interdum sapien et ipsum pellentesque, ut fringilla eros scelerisque. Mauris ex ex, viverra pharetra cursus gravida, vulputate ac velit.",
  "pillars": []
}
